<?xml version="1.0" encoding="us-ascii"?>
<!DOCTYPE softwarecomponent SYSTEM "../dtd/softwarecomponent.dtd">
<!--
    Generated by Zeligsoft Component Enabler 2.0.2 (Build: 200510131317)
    http://www.zeligsoft.com
-->
<softwarecomponent>
    <corbaversion>2.2</corbaversion>
    <componentrepid repid="IDL:CF/ExecutableDevice:1.0" />
    <componenttype>executabledevice</componenttype>
    <componentfeatures>
        <supportsinterface repid="IDL:CF/ExecutableDevice:1.0" supportsname="ExecutableDevice" />
        <supportsinterface repid="IDL:CF/Device:1.0" supportsname="Device" />
        <supportsinterface repid="IDL:CF/LoadableDevice:1.0" supportsname="LoadableDevice" />
        <supportsinterface repid="IDL:CF/Resource:1.0" supportsname="Resource" />
        <supportsinterface repid="IDL:CF/PortSupplier:1.0" supportsname="PortSupplier" />
        <supportsinterface repid="IDL:CF/PropertySet:1.0" supportsname="PropertySet" />
        <supportsinterface repid="IDL:CF/TestableObject:1.0" supportsname="TestableObject" />
        <supportsinterface repid="IDL:CF/LifeCycle:1.0" supportsname="LifeCycle" />
        <ports />
    </componentfeatures>
    <interfaces>
        <interface repid="IDL:CF/ExecutableDevice:1.0" name="ExecutableDevice">
            <!--[Inherited interface IDL:CF/Device:1.0]-->
            <inheritsinterface repid="IDL:CF/Device:1.0" />
            <!--[Inherited interface IDL:CF/LoadableDevice:1.0]-->
            <inheritsinterface repid="IDL:CF/LoadableDevice:1.0" />
            <!--[Inherited interface IDL:CF/Resource:1.0]-->
            <inheritsinterface repid="IDL:CF/Resource:1.0" />
            <!--[Inherited interface IDL:CF/PortSupplier:1.0]-->
            <inheritsinterface repid="IDL:CF/PortSupplier:1.0" />
            <!--[Inherited interface IDL:CF/PropertySet:1.0]-->
            <inheritsinterface repid="IDL:CF/PropertySet:1.0" />
            <!--[Inherited interface IDL:CF/TestableObject:1.0]-->
            <inheritsinterface repid="IDL:CF/TestableObject:1.0" />
            <!--[Inherited interface IDL:CF/LifeCycle:1.0]-->
            <inheritsinterface repid="IDL:CF/LifeCycle:1.0" />
        </interface>
    </interfaces>
</softwarecomponent>
