<?xml version="1.0" encoding="us-ascii"?>
	<!DOCTYPE softwarecomponent SYSTEM "../dtd/softwarecomponent.dtd">
	<!--
	    Generated by Zeligsoft Component Enabler 2.0.2 (Build: 200510131317)
	    http://www.zeligsoft.com
	-->
	<softwarecomponent>
	    <corbaversion>2.2</corbaversion>
	    <componentrepid repid="IDL:CF/Device:1.0" />
 	    <componenttype>device</componenttype>
 	    <componentfeatures>
 	        <supportsinterface repid="IDL:CF/Device:1.0" supportsname="Device" />
 	        <supportsinterface repid="IDL:CF/PropertySet:1.0" supportsname="PropertySet" />
 	        <supportsinterface repid="IDL:CF/Resource:1.0" supportsname="Resource" />
 	        <supportsinterface repid="IDL:CF/PortSupplier:1.0" supportsname="PortSupplier" />
 	        <supportsinterface repid="IDL:CF/LifeCycle:1.0" supportsname="LifeCycle" />
 	        <supportsinterface repid="IDL:CF/TestableObject:1.0" supportsname="TestableObject" />
 	        <ports>
 	            <provides repid="IDL:standardInterfaces/complexShort:1.0" providesname="soundOut">
 	                <porttype type="data" />
 	            </provides>
 	            <provides repid="IDL:standardInterfaces/audioInControl:1.0" providesname="soundInControl">
 	                <porttype type="control" />
 	            </provides>
 	            <provides repid="IDL:standardInterfaces/audioOutControl:1.0" providesname="soundOutControl">
 	                <porttype type="control" />
 	            </provides>
 	            <uses repid="IDL:StdInterfaces/AudioPort:1.0" usesname="soundIn">
 	                <porttype type="control" />
 	            </uses>
 	        </ports>
 	    </componentfeatures>
 	    <interfaces>
 	        <interface repid="IDL:StdInterfaces/AudioPort:1.0" name="AudioPort" />
 	        <interface repid="IDL:CF/Device:1.0" name="Device">
 	            <!--[Inherited interface IDL:CF/PropertySet:1.0]-->
 	            <inheritsinterface repid="IDL:CF/PropertySet:1.0" />
 	            <!--[Inherited interface IDL:CF/Resource:1.0]-->
 	            <inheritsinterface repid="IDL:CF/Resource:1.0" />
 	            <!--[Inherited interface IDL:CF/PortSupplier:1.0]-->
 	            <inheritsinterface repid="IDL:CF/PortSupplier:1.0" />
 	            <!--[Inherited interface IDL:CF/LifeCycle:1.0]-->
 	            <inheritsinterface repid="IDL:CF/LifeCycle:1.0" />
 	            <!--[Inherited interface IDL:CF/TestableObject:1.0]-->
 	            <inheritsinterface repid="IDL:CF/TestableObject:1.0" />
 	        </interface>
 	        <interface repid="IDL:standardInterfaces/audioInControl:1.0" name="audioInControl" />
 	        <interface repid="IDL:standardInterfaces/audioOutControl:1.0" name="audioOutControl" />
 	    </interfaces>
	</softwarecomponent>
